{
  "slot": "outfit_plan",
  "display_name": "穿搭方案",
  "status": "draft",
  "version": 1,
  "skill": "ootd-stylist",
  "content_layout": { "layout_type": "list", "config": { "index_prefix": "Look" } },
  "content": [
    {
      "id": "look-basic",
      "component_type": "card",
      "variant": "landscape",
      "title": "基础百搭",
      "subtitle": "安全好驾驭的通勤搭配，零失误。",
      "text": "上装：白色丝质衬衫\n下装：米色直筒西裤\n外套：无\n鞋：杏色乐福鞋\n包：奶油色托特包\n配饰：细金属腰带",
      "tags": [{ "label": "基础百搭" }, { "label": "通勤" }],
      "detail": null
    }
  ]
}
